{
  "$schema": "https://json-schema.org/draft/2020-12/schema",
  "$id": "https://aicte.gov.in/schemas/v4/document_type_response.schema.json",
  "title": "Document Type Response",
  "description": "Response emitted by POST /applications/{id}/documents/{doc_id}/type upon evaluating page 1 text against deterministic document typing rules, bounded slot priors, and evidence grounding (Guide §11.1 S5).",
  "type": "object",
  "required": [
    "application_id",
    "document_id",
    "doc_type",
    "confidence",
    "is_classified",
    "decision_reason",
    "pipeline_stage",
    "evidence",
    "candidate_scores",
    "flags",
    "simulated",
    "advisory"
  ],
  "properties": {
    "application_id": {
      "type": "string",
      "description": "Identifier of the target application"
    },
    "document_id": {
      "type": "string",
      "description": "Unique document identifier"
    },
    "doc_slot": {
      "type": ["string", "null"],
      "description": "Assigned document slot name declared at upload"
    },
    "doc_type": {
      "type": "string",
      "description": "Classified document type (FIRE_NOC, ACCREDITATION, EOA_LETTER, AFFIDAVIT, BUILDING_PLAN, BUILDING_COMPLETION, LAND_DOCUMENTS, FACULTY_LIST) or UNCLASSIFIED"
    },
    "confidence": {
      "type": "number",
      "minimum": 0.0,
      "maximum": 1.0,
      "description": "Calibrated classification confidence score"
    },
    "is_classified": {
      "type": "boolean",
      "description": "True if accepted with sufficient margin and threshold; false if UNCLASSIFIED"
    },
    "decision_reason": {
      "type": "string",
      "description": "Plain-language justification for classification decision"
    },
    "pipeline_stage": {
      "type": "string",
      "enum": ["S5_TYPING"],
      "description": "Architectural pipeline stage identifier per Guide §11.1"
    },
    "evidence": {
      "type": "array",
      "description": "Grounding evidence items mapping keywords/patterns to page blocks and bounding boxes",
      "items": {
        "type": "object",
        "required": ["phrase", "pattern", "weight"],
        "properties": {
          "phrase": { "type": "string" },
          "pattern": { "type": "string" },
          "weight": { "type": "number" },
          "block_id": { "type": ["string", "null"] },
          "bbox_norm": {
            "type": ["array", "null"],
            "items": { "type": "number" },
            "minItems": 4,
            "maxItems": 4
          }
        }
      }
    },
    "candidate_scores": {
      "type": "object",
      "description": "Total rule match score per candidate document type",
      "additionalProperties": {
        "type": "number"
      }
    },
    "flags": {
      "type": "array",
      "description": "Advisory preliminary indicator flags (e.g. DOC_TYPE_SLOT_MISMATCH)",
      "items": {
        "type": "object"
      }
    },
    "idempotent_cached": {
      "type": "boolean",
      "description": "True if served from database cache"
    },
    "simulated": {
      "type": "boolean",
      "description": "True in demo prototype indicating synthetic data / evaluation"
    },
    "advisory": {
      "type": "boolean",
      "description": "Decision-support flag; does not constitute regulatory decision"
    }
  },
  "additionalProperties": false
}
